Authors,Title,Publication,Volume,Number,Pages,Year,Publisher
"Khara, Biswajit; Balu, Aditya; Joshi, Ameya; Sarkar, Soumik; Hegde, Chinmay; Krishnamurthy, Adarsh; Ganapathysubramanian, Baskar; ",NeuFENet: Neural Finite Element Solutions with Theoretical Bounds for Parametric PDEs,arXiv preprint arXiv:2110.01601,,,,2021,
"Jiang, Zhanhong; Lee, Xian Yeow; Tan, Sin Yong; Tan, Kai Liang; Balu, Aditya; Lee, Young M; Hegde, Chinmay; Sarkar, Soumik; ",MDPGT: Momentum-based Decentralized Policy Gradient Tracking,arXiv preprint arXiv:2112.02813,,,,2021,
"Lee, Xian Yeow; Balu, Aditya; Pokuri, Balaji Sesha Sarath; Krishnamurthy, Adarsh; Sarkar, Soumik; Ganapathysubramanian, Baskar; ",Inverse Design of Microstructures via Generative Networks for Organic Solar Cells,AAAI 2022 Workshop on AI for Design and Manufacturing (ADAM),,,,2021,
"Balu, Aditya; Ghadai, Sambit; Bingol, Onur Rauf; Krishnamurthy, Adarsh; ",HyBoDT: Hybrid Bounded Distance Transforms of Trimmed NURBS Models,Journal of Computing and Information Science in Engineering,,,11-Jan,2021,
"Prasad, Anjana Deva; Balu, Aditya; Shah, Harshil; Sarkar, Soumik; Hegde, Chinmay; Krishnamurthy, Adarsh; ",NURBS-Diff: A Differentiable Programming Module For NURBS,Computer-Aided Design,,,103199,2022,Elsevier
